{
  "allowed_variations": {
    "slide_count_delta": 1
  },
  "anti_patterns": "anti-patterns.json",
  "builder": "auto",
  "case_id": "anti-regression-whole-slide-raster",
  "category": "anti_regression",
  "expected_content_lock": "expected-content-lock.md",
  "expected_metrics": {
    "source_coverage_ratio": 0.9,
    "whole_slide_raster_count": 0
  },
  "expected_ppt_ir": "expected-ppt-ir.json",
  "expected_style_contract": "expected-style-contract.json",
  "profile": "premium",
  "reference_rubric": "reference-rubric.json",
  "renderer": "auto",
  "requirements_file": "requirements.json",
  "schema_version": "1.0",
  "source_files": [
    "source.md"
  ],
  "title": "Whole Slide Raster Regression"
}
